{
  "$schema": "../../core/theme.schema.json",

  "themeFeatures": [
    {
      "name": "code-highlighting",
      "entry": "features/code-highlighting/index.js"
    }
  ],

  "build": {
    "purgeCSS": {
      "safelist": {
        "deep": [
          "data-theme",
          "data-component",
          "language-",
          "code",
          "pre",
          "token",
          "diff-highlight"
        ],
        "greedy": ["language-"]
      }
    }
  },

  "assets": {
    "styles": {
      "entry": "styles/main.scss"
    },
    "scripts": {
      "entry": "scripts/main.js"
    }
  },

  "config": {
    "themeToggle": {
      "defaultTheme": "auto",
      "showToggle": true
    },
    "colors": {
      "light": {
        "background": "#ffffff",
        "surface": "#deebf7",
        "primary": "#172c51",
        "secondary": "#5b9bd5",
        "accent": "#ca7033",
        "text": "#172c51",
        "textMuted": "#4a5568",
        "link": "#5b9bd5",
        "linkHover": "#172c51",
        "border": "#deebf7"
      },
      "dark": {
        "background": "#0f172a",
        "surface": "#1e293b",
        "primary": "#5b9bd5",
        "secondary": "#ca7033",
        "accent": "#ca7033",
        "text": "#e2e8f0",
        "textMuted": "#94a3b8",
        "link": "#5b9bd5",
        "linkHover": "#ca7033",
        "border": "#334155"
      }
    },
    "typography": {
      "fontFamily": "-apple-system, system-ui, sans-serif",
      "fontFamilyHeading": "inherit",
      "fontFamilyMono": "'Consolas', 'Monaco', monospace",
      "fontSize": "1rem",
      "lineHeight": "1.6"
    },
    "logos": {
      "default": "",
      "dark": "",
      "favicon": "/favicon.svg"
    },
    "social": [],
    "socialPlatforms": {
      "twitter": "https://twitter.com/{account}",
      "x": "https://x.com/{account}",
      "github": "https://github.com/{account}",
      "linkedin": "https://linkedin.com/in/{account}",
      "youtube": "https://youtube.com/@{account}",
      "instagram": "https://instagram.com/{account}",
      "facebook": "https://facebook.com/{account}",
      "tiktok": "https://tiktok.com/@{account}",
      "discord": "https://discord.gg/{account}",
      "twitch": "https://twitch.tv/{account}",
      "reddit": "https://reddit.com/user/{account}",
      "bluesky": "https://bsky.app/profile/{account}",
      "mastodon": "https://{instance}/@{user}"
    },
    "analytics": {
      "googleAnalytics": "",
      "plausible": ""
    },
    "features": {
      "darkMode": true,
      "search": false,
      "rss": true,
      "sitemap": true
    },
    "comments": {
      "enabled": false,
      "provider": "disqus",
      "disqus": {
        "shortname": ""
      }
    },
    "navigation": {
      "showHomeLink": true,
      "pagination": {
        "enabled": true,
        "pageSize": 10
      }
    },
    "codeHighlighting": {
      "prismTheme": "prism-tomorrow",
      "diffHighlight": true
    },
    "footer": {
      "copyright": "{year} {site.title}",
      "startYear": null,
      "showPoweredBy": true,
      "showGitSha": true,
      "gitHubRepo": ""
    }
  }
}
